{
  "$ref": "#/definitions/Identify",
  "$schema": "http://json-schema.org/draft-07/schema#",
  "definitions": {
    "Identify": {
      "additionalProperties": false,
      "properties": {
        "confidenceBand": {
          "enum": [
            "high",
            "medium",
            "low",
            "unavailable"
          ],
          "type": "string"
        },
        "indexVersion": {
          "maxLength": 200,
          "minLength": 1,
          "type": "string"
        },
        "matches": {
          "items": {
            "additionalProperties": false,
            "properties": {
              "catalogId": {
                "maxLength": 200,
                "minLength": 1,
                "type": "string"
              },
              "explanation": {
                "type": "string"
              },
              "matchedReferencePhotoIds": {
                "items": {
                  "maxLength": 200,
                  "minLength": 1,
                  "type": "string"
                },
                "type": "array"
              },
              "name": {
                "type": [
                  "string",
                  "null"
                ]
              },
              "rank": {
                "exclusiveMinimum": 0,
                "type": "integer"
              },
              "score": {
                "maximum": 1,
                "minimum": 0,
                "type": "number"
              }
            },
            "required": [
              "catalogId",
              "name",
              "score",
              "rank",
              "matchedReferencePhotoIds",
              "explanation"
            ],
            "type": "object"
          },
          "type": "array"
        },
        "model": {
          "maxLength": 200,
          "minLength": 1,
          "type": "string"
        },
        "uploadUrl": {
          "format": "uri",
          "pattern": "^https?:\\/\\/",
          "type": "string"
        }
      },
      "required": [
        "matches",
        "confidenceBand",
        "model",
        "indexVersion"
      ],
      "type": "object"
    }
  }
}
